slug,filename,canonical_url,title,og_title,meta_description,og_description,meta_keywords,og_image,published_date,modified_date,author,category,h1,h2,h3,h4,paragraph_count,first_paragraph,main_text_length,image_count,images,image_alts,internal_links_count,external_links_count,faq_count,table_count,breadcrumbs
notifications,notifications.html,logout.html,ᐅ Aktive • The New Way to Lose Weight,ᐅ Aktive • The New Way to Lose Weight,"Start your weight loss journey with Aktive’s proven, science-based plans, tailored to meet your individual goals and deliver real results. Join us now!","Start your weight loss journey with Aktive’s proven, science-based plans, tailored to meet your individual goals and deliver real results. Join us now!",,//cdn.aktive.co.in/images/in/theme/aktive-logo-200.png,,,,,"Let science help you lose weight, and keep it off","What if you could trick your brain, thinking you’re full? | The good news: Our treatment gives your brain the ‘full’ signal | Clinical trials show that with our approach, you lose 5 times more weight than with diet & exercise alone. | A proven result of 21% weight loss in 16 months. Curious as to how much you could lose? | The breakthrough in weight loss medication has hit the news big time. | Simple, smart, and scientific. Our weight loss programme works where others fail. | Ready to start losing weight and feeling fit? Take your first step now: | Your health guide",Disclaimer and sources,,26,We have sent a passcode to above number. Please enter your code.,428,38,"data:image/gif;base64,R0lGODlhAQABAAD/ACwAAAAAAQABAAACADs= | https://cdn.aktive.co.in/images/brand/theme/banner-image.jpg?v=1.1 | https://cdn.aktive.co.in/images/brand/theme/banner-1.webp?v=1.1 | https://cdn.aktive.co.in/images/brand/theme/banner-graph.svg?v=2.1 | data:image/gif;base64,R0lGODlhAQABAAD/ACwAAAAAAQABAAACADs= | data:image/gif;base64,R0lGODlhAQABAAD/ACwAAAAAAQABAAACADs= | https://cdn.aktive.co.in/images/brand/theme/graph-line-v3.png?v=1.1 | data:image/gif;base64,R0lGODlhAQABAAD/ACwAAAAAAQABAAACADs= | data:image/gif;base64,R0lGODlhAQABAAD/ACwAAAAAAQABAAACADs= | data:image/gif;base64,R0lGODlhAQABAAD/ACwAAAAAAQABAAACADs= | data:image/gif;base64,R0lGODlhAQABAAD/ACwAAAAAAQABAAACADs= | data:image/gif;base64,R0lGODlhAQABAAD/ACwAAAAAAQABAAACADs= | data:image/gif;base64,R0lGODlhAQABAAD/ACwAAAAAAQABAAACADs= | data:image/gif;base64,R0lGODlhAQABAAD/ACwAAAAAAQABAAACADs= | data:image/gif;base64,R0lGODlhAQABAAD/ACwAAAAAAQABAAACADs= | data:image/gif;base64,R0lGODlhAQABAAD/ACwAAAAAAQABAAACADs= | data:image/gif;base64,R0lGODlhAQABAAD/ACwAAAAAAQABAAACADs= | data:image/gif;base64,R0lGODlhAQABAAD/ACwAAAAAAQABAAACADs= | data:image/gif;base64,R0lGODlhAQABAAD/ACwAAAAAAQABAAACADs= | data:image/gif;base64,R0lGODlhAQABAAD/ACwAAAAAAQABAAACADs= | data:image/gif;base64,R0lGODlhAQABAAD/ACwAAAAAAQABAAACADs= | data:image/gif;base64,R0lGODlhAQABAAD/ACwAAAAAAQABAAACADs= | data:image/gif;base64,R0lGODlhAQABAAD/ACwAAAAAAQABAAACADs= | data:image/gif;base64,R0lGODlhAQABAAD/ACwAAAAAAQABAAACADs= | data:image/gif;base64,R0lGODlhAQABAAD/ACwAAAAAAQABAAACADs= | data:image/gif;base64,R0lGODlhAQABAAD/ACwAAAAAAQABAAACADs= | data:image/gif;base64,R0lGODlhAQABAAD/ACwAAAAAAQABAAACADs= | data:image/gif;base64,R0lGODlhAQABAAD/ACwAAAAAAQABAAACADs= | data:image/gif;base64,R0lGODlhAQABAAD/ACwAAAAAAQABAAACADs= | data:image/gif;base64,R0lGODlhAQABAAD/ACwAAAAAAQABAAACADs= | data:image/gif;base64,R0lGODlhAQABAAD/ACwAAAAAAQABAAACADs= | data:image/gif;base64,R0lGODlhAQABAAD/ACwAAAAAAQABAAACADs= | data:image/gif;base64,R0lGODlhAQABAAD/ACwAAAAAAQABAAACADs= | data:image/gif;base64,R0lGODlhAQABAAD/ACwAAAAAAQABAAACADs= | data:image/gif;base64,R0lGODlhAQABAAD/ACwAAAAAAQABAAACADs= | data:image/gif;base64,R0lGODlhAQABAAD/ACwAAAAAAQABAAACADs= | https://cdn.aktive.co.in/images/in/theme/apple-mob-logo.png | https://cdn.aktive.co.in/images/in/theme/google-mob-logo.png","Aktive | Banner image | Let science help you lose weight, and keep it off | Let science help you lose weight, and keep it off | Brain image | Brain image2 | graph line | Reuters | Business Standard | India Today | The Indian Express | Firstpost | I love food too much to go on a diet | Why is this different from other weight loss plans? | I've tried everything... nothing works | I don't have time to exercise | It’s too difficult to stay motivated | Select the plan that suits you | Answer a few medical questions | Receive your supply | Mounjaro weight loss timeline: A complete guide | 9 almost zero-calorie foods that’ll help you lose weight | How to increase weight loss on Mounjaro? | How to increase weight loss on Wegovy? | 8 healthy Indian breakfast recipes for weight loss | 7-day high-protein diet plan for weight loss (Indian recipes) | How much protein does 100g chana have? | Protein in 100g soya: Benefits, nutrition, & daily intake guide | Wegovy dosage guide for weight loss | How to inject Wegovy - A complete guide | Mounjaro dosage for weight loss | Wegovy side effects | mounjaro side effects | wegovy injection | How to take Mounjaro injection? | 11 benefits of drinking hot water you didn’t know about | Logo | Logo",61,5,0,0,
our-partners,our-partners.html,our-partners.html,ᐅ Our Partners • Aktive,ᐅ Our Partners • Aktive,Meet our trusted partners — licensed doctors and certified pharmacy providers. Learn more about who helps deliver safe and effective care through Aktive.,Meet our trusted partners — licensed doctors and certified pharmacy providers. Learn more about who helps deliver safe and effective care through Aktive.,,//cdn.aktive.co.in/images/in/theme/aktive-logo-200.png,,,,,Our partners,Our partner doctor | Our partner pharmacy,,,5,We have sent a passcode to above number. Please enter your code.,0,3,"data:image/gif;base64,R0lGODlhAQABAAD/ACwAAAAAAQABAAACADs= | https://cdn.aktive.co.in/images/in/theme/apple-mob-logo.png | https://cdn.aktive.co.in/images/in/theme/google-mob-logo.png",Aktive | Logo | Logo,37,3,0,0,
ozempic-for-weight-loss,ozempic-for-weight-loss.html,ozempic-for-weight-loss.html,"Ozempic for Weight Loss: Uses, Benefits, and Results","Ozempic for Weight Loss: Uses, Benefits, and Results","Can Ozempic help you lose weight? Explore its benefits, usage, and availability in India in this comprehensive guide.","Can Ozempic help you lose weight? Explore its benefits, usage, and availability in India in this comprehensive guide.",,//cdn.aktive.co.in/images/in/theme/aktive-logo-200.png,,,,,All about Ozempic injection for weight loss,"Key takeaways | What is Ozempic used for? | How does it work? | Benefits of taking Ozempic injection: | Who can take Ozempic? | Who should avoid Ozempic? | How to take Ozempic? | How to store Ozempic injection? | How to dispose Ozempic injection and needles safely? | Ozempic side effects | Real people, real results: Ozempic success stories | Is Ozempic available in India? | What is Ozempic price in India? | FAQs",Weight loss and A1C reduction: | Semaglutide vs Placebo For Weight Loss and A1C Reduction | Cardiovascular and kidney health | Cancer risk reduction: | Follow these step-by-step instructions while injecting yourself with Ozempic: | Dosage schedule | Potential drug interactions | Common side effects | Less common side effects | Rare side effects | How to manage Ozempic side effects | Conclusion,,90,We have sent a passcode to above number. Please enter your code.,19322,12,"data:image/gif;base64,R0lGODlhAQABAAD/ACwAAAAAAQABAAACADs= | https://cdn.aktive.co.in/images/in/page/ozempic-insulin-injection-pen-cartridge-diabetics-new1.webp | data:image/gif;base64,R0lGODlhAQABAAD/ACwAAAAAAQABAAACADs= | data:image/gif;base64,R0lGODlhAQABAAD/ACwAAAAAAQABAAACADs= | data:image/gif;base64,R0lGODlhAQABAAD/ACwAAAAAAQABAAACADs= | data:image/gif;base64,R0lGODlhAQABAAD/ACwAAAAAAQABAAACADs= | data:image/gif;base64,R0lGODlhAQABAAD/ACwAAAAAAQABAAACADs= | data:image/gif;base64,R0lGODlhAQABAAD/ACwAAAAAAQABAAACADs= | data:image/gif;base64,R0lGODlhAQABAAD/ACwAAAAAAQABAAACADs= | data:image/gif;base64,R0lGODlhAQABAAD/ACwAAAAAAQABAAACADs= | https://cdn.aktive.co.in/images/in/theme/apple-mob-logo.png | https://cdn.aktive.co.in/images/in/theme/google-mob-logo.png",Aktive | Ozempic injection pen | How Semaglutide works | Semaglutide vs Placebo For Weight Loss and A1C Reduction | Prepare the pen and needle | Place the new needle | Check the flow | Select the dose | select the injection site | Inject the dose | Logo | Logo,57,18,14,2,
poha-benefits,poha-benefits.html,poha-benefits.html,Poha Health Benefits: Can It Help With Weight Loss?,Poha Health Benefits: Can It Help With Weight Loss?,"Discover poha health benefits and how they help with weight loss. It’s healthy, tasty, and easy to make. Check out six interesting poha recipes.","Discover poha health benefits and how they help with weight loss. It’s healthy, tasty, and easy to make. Check out six interesting poha recipes.",,//cdn.aktive.co.in/images/in/theme/aktive-logo-200.png,,,,,Can a dish of poha a day keep the doctor away?,Key takeaways: | What is poha? | Why is poha healthy? | Why is poha (aval) good for weight loss? | Six healthy poha recipes for weight loss | What is the best time to eat poha? | How to make poha more weight-loss-friendly? | How does poha support weight loss? | Four poha myths you must know about | Your Score: 0 out of 4 | FAQs,"Red, white, and brown poha: What’s good for you? | 1. Dadpe pohe | 2. Kande pohe or vegetable poha | 3. Poha chilla | 4. Oats poha | 5. Soya poha | 6. Curd (dahi) poha/Gopalkala | Conclusion",,119,We have sent a passcode to above number. Please enter your code.,1052,11,"data:image/gif;base64,R0lGODlhAQABAAD/ACwAAAAAAQABAAACADs= | https://cdn.aktive.co.in/images/in/page/poha-banner-updated.png | data:image/gif;base64,R0lGODlhAQABAAD/ACwAAAAAAQABAAACADs= | data:image/gif;base64,R0lGODlhAQABAAD/ACwAAAAAAQABAAACADs= | data:image/gif;base64,R0lGODlhAQABAAD/ACwAAAAAAQABAAACADs= | data:image/gif;base64,R0lGODlhAQABAAD/ACwAAAAAAQABAAACADs= | data:image/gif;base64,R0lGODlhAQABAAD/ACwAAAAAAQABAAACADs= | data:image/gif;base64,R0lGODlhAQABAAD/ACwAAAAAAQABAAACADs= | data:image/gif;base64,R0lGODlhAQABAAD/ACwAAAAAAQABAAACADs= | https://cdn.aktive.co.in/images/in/theme/apple-mob-logo.png | https://cdn.aktive.co.in/images/in/theme/google-mob-logo.png",Aktive | A dish of poha | poha images | A dish of dadpe pohe | A plate of kande pohe | Unique poha chilla recipe for weight loss | Healthy oats poha for weight loss | A different take on a poha recipe - soya poha | Gopalkala recipe for weight loss | Logo | Logo,53,6,10,1,
protein-in-100g-soyabean,protein-in-100g-soyabean.html,protein-in-100g-soyabean.html,How Much Protein Does 100g Soya Have - A Quick Guide,How Much Protein Does 100g Soya Have - A Quick Guide,"How much protein does 100g of soya have? Learn more about its nutrients, its benefits, and how it helps you lose weight.","How much protein does 100g of soya have? Learn more about its nutrients, its benefits, and how it helps you lose weight.",,//cdn.aktive.co.in/images/in/theme/aktive-logo-200.png,,,,,"Protein in 100g soya: Benefits, nutrition, & daily intake guide",Key takeaways | What is soya? | How much protein is in 100g soya? | What is the nutritional value of soya? | What are the health benefits of eating soya? | Is soya good for weight loss? | What is the best time to eat soya? | Who should not eat soya? | 8 high-protein soya recipes you’ll love | Conclusion | FAQs,Soya vs other vegetarian protein sources,,97,We have sent a passcode to above number. Please enter your code.,15780,8,"data:image/gif;base64,R0lGODlhAQABAAD/ACwAAAAAAQABAAACADs= | https://cdn.aktive.co.in/images/in/page/soybeans-in-bowl.jpg | https://cdn.aktive.co.in/images/in/page/how-much-protein-in-soya-new-v2.jpg | https://cdn.aktive.co.in/images/in/page/nutritional-value-of-soya-v2.jpg | https://cdn.aktive.co.in/images/in/page/health-benefits-of-eating-soya.svg | https://cdn.aktive.co.in/images/in/page/protein-rich-soya-recipes-img.jpg | https://cdn.aktive.co.in/images/in/theme/apple-mob-logo.png | https://cdn.aktive.co.in/images/in/theme/google-mob-logo.png",Aktive | soybeans in a wooden bowl | Protein in 100g soya | nutritional value of a soya | Infographic for eight benefits of eating soya with an image of soybeans at the centre | high-protein soya recipe | Logo | Logo,59,16,24,1,
quiz?c=1,quiz?c=1.html,,Secure Checkout,,,,,,,,,,,,Medical consultation,,5,Our customer service is availableMon-Fri 10:30-19:30,143,2,https://cdn.aktive.co.in/images/brand/theme/logo.svg | https://cdn.aktive.co.in/images/in/theme/dr-01-v4.png?v=3,My logo | doctor,6,1,0,0,
quiz?p=1&c=1,quiz?p=1&c=1.html,,Secure Checkout,,,,,,,,,,,,,,11,Our customer service is availableMon-Fri 10:30-19:30,138,4,https://cdn.aktive.co.in/images/brand/theme/logo.svg | https://cdn.aktive.co.in/images/brand/theme/measure-line.svg | https://cdn.aktive.co.in/images/in/theme/dr-01-v4.png?v=3 | https://cdn.aktive.co.in/images/in/theme/dr-01-v4.png?v=3,My logo | Measure line | doctor | doctor,4,1,0,0,
rybelsus-tablets-for-weight-loss,rybelsus-tablets-for-weight-loss.html,rybelsus-tablets-for-weight-loss.html,All About Rybelsus Tablet For Weight Loss In India,All About Rybelsus Tablet For Weight Loss In India,"Rybelsus, made from semaglutide, is a revolutionary oral tablet for Indians who want to lose weight. But what should you know before taking it?","Rybelsus, made from semaglutide, is a revolutionary oral tablet for Indians who want to lose weight. But what should you know before taking it?",,//cdn.aktive.co.in/images/in/theme/aktive-logo-200.png,,,,,How Rybelsus tablet helped Indians lose weight,Key Takeaways | What is Rybelsus? | Real people. Real results: Rybelsus success story | The growing popularity of Rybelsus for weight loss in India | Who is eligible to take Rybelsus? | Rybelsus dosage schedule | Rybelsus side effects | Safety advice to follow when taking Rybelsus | Lifestyle changes to make while taking Rybelsus | Drug interactions | Is Rybelsus available in India? | Alternatives to Rybelsus | Conclusion | FAQs,How does Rybelsus work? | Can Rybelsus help with safe weight loss? | How to take Rybelsus? | How to store Rybelsus | Common side effects: | Less common side effects: | Rare but serious side effects: | Tips to handle nausea while on Rybelsus | Lifestyle tips for people on Rybelsus | Foods to eat while taking Rybelsus,,98,We have sent a passcode to above number. Please enter your code.,21933,5,"data:image/gif;base64,R0lGODlhAQABAAD/ACwAAAAAAQABAAACADs= | https://cdn.aktive.co.in/images/in/page/novo_nordisk_pharma_rybelsus-3-mg-semaglutide-310-s-tablets.jpg | data:image/gif;base64,R0lGODlhAQABAAD/ACwAAAAAAQABAAACADs= | https://cdn.aktive.co.in/images/in/theme/apple-mob-logo.png | https://cdn.aktive.co.in/images/in/theme/google-mob-logo.png",Aktive | Rybelsus 3 mg tablets in India | Rybelsus Sales Growth in India | Logo | Logo,59,8,14,2,
subscription,subscription.html,logout.html,ᐅ Aktive • The New Way to Lose Weight,ᐅ Aktive • The New Way to Lose Weight,"Start your weight loss journey with Aktive’s proven, science-based plans, tailored to meet your individual goals and deliver real results. Join us now!","Start your weight loss journey with Aktive’s proven, science-based plans, tailored to meet your individual goals and deliver real results. Join us now!",,//cdn.aktive.co.in/images/in/theme/aktive-logo-200.png,,,,,"Let science help you lose weight, and keep it off","What if you could trick your brain, thinking you’re full? | The good news: Our treatment gives your brain the ‘full’ signal | Clinical trials show that with our approach, you lose 5 times more weight than with diet & exercise alone. | A proven result of 21% weight loss in 16 months. Curious as to how much you could lose? | The breakthrough in weight loss medication has hit the news big time. | Simple, smart, and scientific. Our weight loss programme works where others fail. | Ready to start losing weight and feeling fit? Take your first step now: | Your health guide",Disclaimer and sources,,26,We have sent a passcode to above number. Please enter your code.,428,38,"data:image/gif;base64,R0lGODlhAQABAAD/ACwAAAAAAQABAAACADs= | https://cdn.aktive.co.in/images/brand/theme/banner-image.jpg?v=1.1 | https://cdn.aktive.co.in/images/brand/theme/banner-1.webp?v=1.1 | https://cdn.aktive.co.in/images/brand/theme/banner-graph.svg?v=2.1 | data:image/gif;base64,R0lGODlhAQABAAD/ACwAAAAAAQABAAACADs= | data:image/gif;base64,R0lGODlhAQABAAD/ACwAAAAAAQABAAACADs= | https://cdn.aktive.co.in/images/brand/theme/graph-line-v3.png?v=1.1 | data:image/gif;base64,R0lGODlhAQABAAD/ACwAAAAAAQABAAACADs= | data:image/gif;base64,R0lGODlhAQABAAD/ACwAAAAAAQABAAACADs= | data:image/gif;base64,R0lGODlhAQABAAD/ACwAAAAAAQABAAACADs= | data:image/gif;base64,R0lGODlhAQABAAD/ACwAAAAAAQABAAACADs= | data:image/gif;base64,R0lGODlhAQABAAD/ACwAAAAAAQABAAACADs= | data:image/gif;base64,R0lGODlhAQABAAD/ACwAAAAAAQABAAACADs= | data:image/gif;base64,R0lGODlhAQABAAD/ACwAAAAAAQABAAACADs= | data:image/gif;base64,R0lGODlhAQABAAD/ACwAAAAAAQABAAACADs= | data:image/gif;base64,R0lGODlhAQABAAD/ACwAAAAAAQABAAACADs= | data:image/gif;base64,R0lGODlhAQABAAD/ACwAAAAAAQABAAACADs= | data:image/gif;base64,R0lGODlhAQABAAD/ACwAAAAAAQABAAACADs= | data:image/gif;base64,R0lGODlhAQABAAD/ACwAAAAAAQABAAACADs= | data:image/gif;base64,R0lGODlhAQABAAD/ACwAAAAAAQABAAACADs= | data:image/gif;base64,R0lGODlhAQABAAD/ACwAAAAAAQABAAACADs= | data:image/gif;base64,R0lGODlhAQABAAD/ACwAAAAAAQABAAACADs= | data:image/gif;base64,R0lGODlhAQABAAD/ACwAAAAAAQABAAACADs= | data:image/gif;base64,R0lGODlhAQABAAD/ACwAAAAAAQABAAACADs= | data:image/gif;base64,R0lGODlhAQABAAD/ACwAAAAAAQABAAACADs= | data:image/gif;base64,R0lGODlhAQABAAD/ACwAAAAAAQABAAACADs= | data:image/gif;base64,R0lGODlhAQABAAD/ACwAAAAAAQABAAACADs= | data:image/gif;base64,R0lGODlhAQABAAD/ACwAAAAAAQABAAACADs= | data:image/gif;base64,R0lGODlhAQABAAD/ACwAAAAAAQABAAACADs= | data:image/gif;base64,R0lGODlhAQABAAD/ACwAAAAAAQABAAACADs= | data:image/gif;base64,R0lGODlhAQABAAD/ACwAAAAAAQABAAACADs= | data:image/gif;base64,R0lGODlhAQABAAD/ACwAAAAAAQABAAACADs= | data:image/gif;base64,R0lGODlhAQABAAD/ACwAAAAAAQABAAACADs= | data:image/gif;base64,R0lGODlhAQABAAD/ACwAAAAAAQABAAACADs= | data:image/gif;base64,R0lGODlhAQABAAD/ACwAAAAAAQABAAACADs= | data:image/gif;base64,R0lGODlhAQABAAD/ACwAAAAAAQABAAACADs= | https://cdn.aktive.co.in/images/in/theme/apple-mob-logo.png | https://cdn.aktive.co.in/images/in/theme/google-mob-logo.png","Aktive | Banner image | Let science help you lose weight, and keep it off | Let science help you lose weight, and keep it off | Brain image | Brain image2 | graph line | Reuters | Business Standard | India Today | The Indian Express | Firstpost | I love food too much to go on a diet | Why is this different from other weight loss plans? | I've tried everything... nothing works | I don't have time to exercise | It’s too difficult to stay motivated | Select the plan that suits you | Answer a few medical questions | Receive your supply | Mounjaro weight loss timeline: A complete guide | 9 almost zero-calorie foods that’ll help you lose weight | How to increase weight loss on Mounjaro? | How to increase weight loss on Wegovy? | 8 healthy Indian breakfast recipes for weight loss | 7-day high-protein diet plan for weight loss (Indian recipes) | How much protein does 100g chana have? | Protein in 100g soya: Benefits, nutrition, & daily intake guide | Wegovy dosage guide for weight loss | How to inject Wegovy - A complete guide | Mounjaro dosage for weight loss | Wegovy side effects | mounjaro side effects | wegovy injection | How to take Mounjaro injection? | 11 benefits of drinking hot water you didn’t know about | Logo | Logo",61,5,0,0,
the-science-glp,the-science-glp.html,the-science-glp.html,ᐅ The Science of GLP-1 • How It Helps You Lose Weight,ᐅ The Science of GLP-1 • How It Helps You Lose Weight,"Understand the science of GLP-1 medications for weight loss. Learn how they work, their benefits, side effects, and the science behind their success.","Understand the science of GLP-1 medications for weight loss. Learn how they work, their benefits, side effects, and the science behind their success.",,//cdn.aktive.co.in/images/in/theme/aktive-logo-200.png,,,,,The science of GLP-1,What are GLP-1 medications? | The discovery of GLP-1 | The science of GLP-1: How does it work? | Is GLP-1 scientifically proven? | Tablets vs injections | How long does it take to start working? | Importance of doses | What are the benefits? | How you can make the most out of GLP-1 | What if it doesn’t work? | Take the next step,Healthy food | Exercise,,52,We have sent a passcode to above number. Please enter your code.,8695,15,"data:image/gif;base64,R0lGODlhAQABAAD/ACwAAAAAAQABAAACADs= | https://cdn.aktive.co.in/images/in/page/the-science-glp.jpg | https://cdn.aktive.co.in/images/in/page/brain-solo.png | https://cdn.aktive.co.in/images/in/page/stomach.png | https://cdn.aktive.co.in/images/in/page/blood-sugar.png | data:image/gif;base64,R0lGODlhAQABAAD/ACwAAAAAAQABAAACADs= | data:image/gif;base64,R0lGODlhAQABAAD/ACwAAAAAAQABAAACADs= | data:image/gif;base64,R0lGODlhAQABAAD/ACwAAAAAAQABAAACADs= | data:image/gif;base64,R0lGODlhAQABAAD/ACwAAAAAAQABAAACADs= | data:image/gif;base64,R0lGODlhAQABAAD/ACwAAAAAAQABAAACADs= | data:image/gif;base64,R0lGODlhAQABAAD/ACwAAAAAAQABAAACADs= | data:image/gif;base64,R0lGODlhAQABAAD/ACwAAAAAAQABAAACADs= | data:image/gif;base64,R0lGODlhAQABAAD/ACwAAAAAAQABAAACADs= | https://cdn.aktive.co.in/images/in/theme/apple-mob-logo.png | https://cdn.aktive.co.in/images/in/theme/google-mob-logo.png",Aktive | The science of GLP-1 | brain solo | stomach | blood sugar | An infographic displaying results from a study on Semaglutide | An infographic displaying average weight lost in a study on Semaglutide | An infographic showing progressive weight loss over 12 months | An infographic showing progressive weight loss over 12 months | An infographic showing progressive weight loss over 12 months | An infographic displaying different doses of Semaglutide pens and tablets | An infographic showing Semaglutide starting doses | An infographic showing how the dose can only be increased every 4 weeks | Logo | Logo,56,4,8,2,
types-of-millets,types-of-millets.html,types-of-millets.html,11 Types of Millets and Why You Should Eat Them,11 Types of Millets and Why You Should Eat Them,"Find out why millets are the future of healthy eating! Learn about the types of millets, their benefits, and why they should be part of your daily diet.","Find out why millets are the future of healthy eating! Learn about the types of millets, their benefits, and why they should be part of your daily diet.",,//cdn.aktive.co.in/images/in/theme/aktive-logo-200.png,,,,,Discover 11 types of millets in India and their health benefits,Key takeaways: | What are millets? | The 11 types of millets in India | Some lesser-known millet health benefits | Are there any side effects of eating millets? | Run of the mill? Not anymore… | FAQs,1. Sorghum millet (Jowar) | 2. Pearl millet (Bajra) | 3. Finger millet (Ragi) | 4. Foxtail millet (Kangni) | 5. Barnyard millet (Sawan) | 6. Proso millet (Chena) | 7. Little millet (Kutki) | 8. Kodo millet (Kodon) | 9. Browntop millet (Choti kangni) | 10. Buckwheat millet (Kuttu) | 11. Amaranth millet (Rajgira) | Nutritional value of millets | What does this mean for our health? | 16 lesser-known millet health benefits,,134,We have sent a passcode to above number. Please enter your code.,19807,16,"data:image/gif;base64,R0lGODlhAQABAAD/ACwAAAAAAQABAAACADs= | https://cdn.aktive.co.in/images/in/page/final-millets-bannr-v1.jpg | data:image/gif;base64,R0lGODlhAQABAAD/ACwAAAAAAQABAAACADs= | data:image/gif;base64,R0lGODlhAQABAAD/ACwAAAAAAQABAAACADs= | data:image/gif;base64,R0lGODlhAQABAAD/ACwAAAAAAQABAAACADs= | data:image/gif;base64,R0lGODlhAQABAAD/ACwAAAAAAQABAAACADs= | data:image/gif;base64,R0lGODlhAQABAAD/ACwAAAAAAQABAAACADs= | data:image/gif;base64,R0lGODlhAQABAAD/ACwAAAAAAQABAAACADs= | data:image/gif;base64,R0lGODlhAQABAAD/ACwAAAAAAQABAAACADs= | data:image/gif;base64,R0lGODlhAQABAAD/ACwAAAAAAQABAAACADs= | data:image/gif;base64,R0lGODlhAQABAAD/ACwAAAAAAQABAAACADs= | data:image/gif;base64,R0lGODlhAQABAAD/ACwAAAAAAQABAAACADs= | data:image/gif;base64,R0lGODlhAQABAAD/ACwAAAAAAQABAAACADs= | https://cdn.aktive.co.in/images/in/page/nutritional-value-of-millet.svg | https://cdn.aktive.co.in/images/in/theme/apple-mob-logo.png | https://cdn.aktive.co.in/images/in/theme/google-mob-logo.png",Aktive | Types of Millets in India | Sorghum Millet or Jowar | Pearl Millet or Bajra | Finger Millet or Ragi | Foxtail Millet or Kangni | Barnyard Millet or Sawan | Proso Millet or Chena | Little Millet or Kutki | Kodo Millet or Kodon | Browntop Millet (Choti Kangni) | Buckwheat Millet (Kuttu) | Amaranth Millet (Rajgira) | Nutritional value of millets | Logo | Logo,68,28,7,0,
