slug,filename,canonical_url,title,og_title,meta_description,og_description,meta_keywords,og_image,published_date,modified_date,author,category,h1,h2,h3,h4,paragraph_count,first_paragraph,main_text_length,image_count,images,image_alts,internal_links_count,external_links_count,faq_count,table_count,breadcrumbs
membership-benefits,membership-benefits.html,logout.html,ᐅ Aktive • The New Way to Lose Weight,ᐅ Aktive • The New Way to Lose Weight,"Start your weight loss journey with Aktive’s proven, science-based plans, tailored to meet your individual goals and deliver real results. Join us now!","Start your weight loss journey with Aktive’s proven, science-based plans, tailored to meet your individual goals and deliver real results. Join us now!",,//cdn.aktive.co.in/images/in/theme/aktive-logo-200.png,,,,,"Let science help you lose weight, and keep it off","What if you could trick your brain, thinking you’re full? | The good news: Our treatment gives your brain the ‘full’ signal | Clinical trials show that with our approach, you lose 5 times more weight than with diet & exercise alone. | A proven result of 21% weight loss in 16 months. Curious as to how much you could lose? | The breakthrough in weight loss medication has hit the news big time. | Simple, smart, and scientific. Our weight loss programme works where others fail. | Ready to start losing weight and feeling fit? Take your first step now: | Your health guide",Disclaimer and sources,,26,We have sent a passcode to above number. Please enter your code.,428,38,"data:image/gif;base64,R0lGODlhAQABAAD/ACwAAAAAAQABAAACADs= | https://cdn.aktive.co.in/images/brand/theme/banner-image.jpg?v=1.1 | https://cdn.aktive.co.in/images/brand/theme/banner-1.webp?v=1.1 | https://cdn.aktive.co.in/images/brand/theme/banner-graph.svg?v=2.1 | data:image/gif;base64,R0lGODlhAQABAAD/ACwAAAAAAQABAAACADs= | data:image/gif;base64,R0lGODlhAQABAAD/ACwAAAAAAQABAAACADs= | https://cdn.aktive.co.in/images/brand/theme/graph-line-v3.png?v=1.1 | data:image/gif;base64,R0lGODlhAQABAAD/ACwAAAAAAQABAAACADs= | data:image/gif;base64,R0lGODlhAQABAAD/ACwAAAAAAQABAAACADs= | data:image/gif;base64,R0lGODlhAQABAAD/ACwAAAAAAQABAAACADs= | data:image/gif;base64,R0lGODlhAQABAAD/ACwAAAAAAQABAAACADs= | data:image/gif;base64,R0lGODlhAQABAAD/ACwAAAAAAQABAAACADs= | data:image/gif;base64,R0lGODlhAQABAAD/ACwAAAAAAQABAAACADs= | data:image/gif;base64,R0lGODlhAQABAAD/ACwAAAAAAQABAAACADs= | data:image/gif;base64,R0lGODlhAQABAAD/ACwAAAAAAQABAAACADs= | data:image/gif;base64,R0lGODlhAQABAAD/ACwAAAAAAQABAAACADs= | data:image/gif;base64,R0lGODlhAQABAAD/ACwAAAAAAQABAAACADs= | data:image/gif;base64,R0lGODlhAQABAAD/ACwAAAAAAQABAAACADs= | data:image/gif;base64,R0lGODlhAQABAAD/ACwAAAAAAQABAAACADs= | data:image/gif;base64,R0lGODlhAQABAAD/ACwAAAAAAQABAAACADs= | data:image/gif;base64,R0lGODlhAQABAAD/ACwAAAAAAQABAAACADs= | data:image/gif;base64,R0lGODlhAQABAAD/ACwAAAAAAQABAAACADs= | data:image/gif;base64,R0lGODlhAQABAAD/ACwAAAAAAQABAAACADs= | data:image/gif;base64,R0lGODlhAQABAAD/ACwAAAAAAQABAAACADs= | data:image/gif;base64,R0lGODlhAQABAAD/ACwAAAAAAQABAAACADs= | data:image/gif;base64,R0lGODlhAQABAAD/ACwAAAAAAQABAAACADs= | data:image/gif;base64,R0lGODlhAQABAAD/ACwAAAAAAQABAAACADs= | data:image/gif;base64,R0lGODlhAQABAAD/ACwAAAAAAQABAAACADs= | data:image/gif;base64,R0lGODlhAQABAAD/ACwAAAAAAQABAAACADs= | data:image/gif;base64,R0lGODlhAQABAAD/ACwAAAAAAQABAAACADs= | data:image/gif;base64,R0lGODlhAQABAAD/ACwAAAAAAQABAAACADs= | data:image/gif;base64,R0lGODlhAQABAAD/ACwAAAAAAQABAAACADs= | data:image/gif;base64,R0lGODlhAQABAAD/ACwAAAAAAQABAAACADs= | data:image/gif;base64,R0lGODlhAQABAAD/ACwAAAAAAQABAAACADs= | data:image/gif;base64,R0lGODlhAQABAAD/ACwAAAAAAQABAAACADs= | data:image/gif;base64,R0lGODlhAQABAAD/ACwAAAAAAQABAAACADs= | https://cdn.aktive.co.in/images/in/theme/apple-mob-logo.png | https://cdn.aktive.co.in/images/in/theme/google-mob-logo.png","Aktive | Banner image | Let science help you lose weight, and keep it off | Let science help you lose weight, and keep it off | Brain image | Brain image2 | graph line | Reuters | Business Standard | India Today | The Indian Express | Firstpost | I love food too much to go on a diet | Why is this different from other weight loss plans? | I've tried everything... nothing works | I don't have time to exercise | It’s too difficult to stay motivated | Select the plan that suits you | Answer a few medical questions | Receive your supply | Mounjaro weight loss timeline: A complete guide | 9 almost zero-calorie foods that’ll help you lose weight | How to increase weight loss on Mounjaro? | How to increase weight loss on Wegovy? | 8 healthy Indian breakfast recipes for weight loss | 7-day high-protein diet plan for weight loss (Indian recipes) | How much protein does 100g chana have? | Protein in 100g soya: Benefits, nutrition, & daily intake guide | Wegovy dosage guide for weight loss | How to inject Wegovy - A complete guide | Mounjaro dosage for weight loss | Wegovy side effects | mounjaro side effects | wegovy injection | How to take Mounjaro injection? | 11 benefits of drinking hot water you didn’t know about | Logo | Logo",61,5,0,0,
messaging,messaging.html,logout.html,ᐅ Aktive • The New Way to Lose Weight,ᐅ Aktive • The New Way to Lose Weight,"Start your weight loss journey with Aktive’s proven, science-based plans, tailored to meet your individual goals and deliver real results. Join us now!","Start your weight loss journey with Aktive’s proven, science-based plans, tailored to meet your individual goals and deliver real results. Join us now!",,//cdn.aktive.co.in/images/in/theme/aktive-logo-200.png,,,,,"Let science help you lose weight, and keep it off","What if you could trick your brain, thinking you’re full? | The good news: Our treatment gives your brain the ‘full’ signal | Clinical trials show that with our approach, you lose 5 times more weight than with diet & exercise alone. | A proven result of 21% weight loss in 16 months. Curious as to how much you could lose? | The breakthrough in weight loss medication has hit the news big time. | Simple, smart, and scientific. Our weight loss programme works where others fail. | Ready to start losing weight and feeling fit? Take your first step now: | Your health guide",Disclaimer and sources,,26,We have sent a passcode to above number. Please enter your code.,428,38,"data:image/gif;base64,R0lGODlhAQABAAD/ACwAAAAAAQABAAACADs= | https://cdn.aktive.co.in/images/brand/theme/banner-image.jpg?v=1.1 | https://cdn.aktive.co.in/images/brand/theme/banner-1.webp?v=1.1 | https://cdn.aktive.co.in/images/brand/theme/banner-graph.svg?v=2.1 | data:image/gif;base64,R0lGODlhAQABAAD/ACwAAAAAAQABAAACADs= | data:image/gif;base64,R0lGODlhAQABAAD/ACwAAAAAAQABAAACADs= | https://cdn.aktive.co.in/images/brand/theme/graph-line-v3.png?v=1.1 | data:image/gif;base64,R0lGODlhAQABAAD/ACwAAAAAAQABAAACADs= | data:image/gif;base64,R0lGODlhAQABAAD/ACwAAAAAAQABAAACADs= | data:image/gif;base64,R0lGODlhAQABAAD/ACwAAAAAAQABAAACADs= | data:image/gif;base64,R0lGODlhAQABAAD/ACwAAAAAAQABAAACADs= | data:image/gif;base64,R0lGODlhAQABAAD/ACwAAAAAAQABAAACADs= | data:image/gif;base64,R0lGODlhAQABAAD/ACwAAAAAAQABAAACADs= | data:image/gif;base64,R0lGODlhAQABAAD/ACwAAAAAAQABAAACADs= | data:image/gif;base64,R0lGODlhAQABAAD/ACwAAAAAAQABAAACADs= | data:image/gif;base64,R0lGODlhAQABAAD/ACwAAAAAAQABAAACADs= | data:image/gif;base64,R0lGODlhAQABAAD/ACwAAAAAAQABAAACADs= | data:image/gif;base64,R0lGODlhAQABAAD/ACwAAAAAAQABAAACADs= | data:image/gif;base64,R0lGODlhAQABAAD/ACwAAAAAAQABAAACADs= | data:image/gif;base64,R0lGODlhAQABAAD/ACwAAAAAAQABAAACADs= | data:image/gif;base64,R0lGODlhAQABAAD/ACwAAAAAAQABAAACADs= | data:image/gif;base64,R0lGODlhAQABAAD/ACwAAAAAAQABAAACADs= | data:image/gif;base64,R0lGODlhAQABAAD/ACwAAAAAAQABAAACADs= | data:image/gif;base64,R0lGODlhAQABAAD/ACwAAAAAAQABAAACADs= | data:image/gif;base64,R0lGODlhAQABAAD/ACwAAAAAAQABAAACADs= | data:image/gif;base64,R0lGODlhAQABAAD/ACwAAAAAAQABAAACADs= | data:image/gif;base64,R0lGODlhAQABAAD/ACwAAAAAAQABAAACADs= | data:image/gif;base64,R0lGODlhAQABAAD/ACwAAAAAAQABAAACADs= | data:image/gif;base64,R0lGODlhAQABAAD/ACwAAAAAAQABAAACADs= | data:image/gif;base64,R0lGODlhAQABAAD/ACwAAAAAAQABAAACADs= | data:image/gif;base64,R0lGODlhAQABAAD/ACwAAAAAAQABAAACADs= | data:image/gif;base64,R0lGODlhAQABAAD/ACwAAAAAAQABAAACADs= | data:image/gif;base64,R0lGODlhAQABAAD/ACwAAAAAAQABAAACADs= | data:image/gif;base64,R0lGODlhAQABAAD/ACwAAAAAAQABAAACADs= | data:image/gif;base64,R0lGODlhAQABAAD/ACwAAAAAAQABAAACADs= | data:image/gif;base64,R0lGODlhAQABAAD/ACwAAAAAAQABAAACADs= | https://cdn.aktive.co.in/images/in/theme/apple-mob-logo.png | https://cdn.aktive.co.in/images/in/theme/google-mob-logo.png","Aktive | Banner image | Let science help you lose weight, and keep it off | Let science help you lose weight, and keep it off | Brain image | Brain image2 | graph line | Reuters | Business Standard | India Today | The Indian Express | Firstpost | I love food too much to go on a diet | Why is this different from other weight loss plans? | I've tried everything... nothing works | I don't have time to exercise | It’s too difficult to stay motivated | Select the plan that suits you | Answer a few medical questions | Receive your supply | Mounjaro weight loss timeline: A complete guide | 9 almost zero-calorie foods that’ll help you lose weight | How to increase weight loss on Mounjaro? | How to increase weight loss on Wegovy? | 8 healthy Indian breakfast recipes for weight loss | 7-day high-protein diet plan for weight loss (Indian recipes) | How much protein does 100g chana have? | Protein in 100g soya: Benefits, nutrition, & daily intake guide | Wegovy dosage guide for weight loss | How to inject Wegovy - A complete guide | Mounjaro dosage for weight loss | Wegovy side effects | mounjaro side effects | wegovy injection | How to take Mounjaro injection? | 11 benefits of drinking hot water you didn’t know about | Logo | Logo",61,5,0,0,
mounjaro-dosage-for-weight-loss,mounjaro-dosage-for-weight-loss.html,mounjaro-dosage-for-weight-loss.html,Mounjaro Dosage Chart: Your Guide to Weight Loss,Mounjaro Dosage Chart: Your Guide to Weight Loss,"Discover the complete Mounjaro dosage chart for weight loss. Learn about starting doses, weekly schedules, adjustments & FAQs for safe use.","Discover the complete Mounjaro dosage chart for weight loss. Learn about starting doses, weekly schedules, adjustments & FAQs for safe use.",,//cdn.aktive.co.in/images/in/theme/aktive-logo-200.png,,,,,Mounjaro dosage chart for weight loss,"Key Takeaways: | What is Mounjaro & how does it work? | Mounjaro dosage chart | How do doctors decide which dose is right for you? | How to monitor your response to dose changes? | What to do if you miss a dose? | When should you pause or lower your dose? | How to ensure a smoother dose escalation? | Go at your own pace, but with proper medical supervision | FAQs",Mounjaro Dosage Schedule :,,76,We have sent a passcode to above number. Please enter your code.,12350,10,"data:image/gif;base64,R0lGODlhAQABAAD/ACwAAAAAAQABAAACADs= | https://cdn.aktive.co.in/images/in/page/Hero-image.jpg | https://cdn.aktive.co.in/images/in/page/mounjaro-dosage-chart-desk-new-1.svg | https://cdn.aktive.co.in/images/in/page/mounjaro-dosage-schedule-desk-new.svg | https://cdn.aktive.co.in/images/in/page/fork-spoon-icon.svg | https://cdn.aktive.co.in/images/in/page/water-drop-icon.svg | https://cdn.aktive.co.in/images/in/page/directions-walk-icon.svg | https://cdn.aktive.co.in/images/in/page/health-and-safety-icon.svg | https://cdn.aktive.co.in/images/in/theme/apple-mob-logo.png | https://cdn.aktive.co.in/images/in/theme/google-mob-logo.png",Aktive | A dosage chart showing different Mounjaro doses | Mounjaro dosage chart | Mounjaro Dosage Schedule | Image 1 | Image 2 | Image 3 | Image 4 | Logo | Logo,51,3,10,1,
mounjaro-injection,mounjaro-injection.html,mounjaro-injection.html,Mounjaro Weight Loss Injection Now Available in India,Mounjaro Weight Loss Injection Now Available in India,"Mounjaro, a new injection for weight loss and type 2 diabetes, is now available in India. Find out how it works, cost, who can take it, and side effects","Mounjaro, a new injection for weight loss and type 2 diabetes, is now available in India. Find out how it works, cost, who can take it, and side effects",,//cdn.aktive.co.in/images/in/theme/aktive-logo-200.png,,,,,Weight loss drug Mounjaro launched in India,Key takeaways: | Mounjaro launch in India: All you need to know about it | What is Mounjaro? | How does Mounjaro work? | How much weight can you lose with Mounjaro? | Are you eligible to take Mounjaro? | How and when to take Mounjaro | How to store and dispose of Mounjaro? | What are the side effects of taking Mounjaro? | 4 lifestyle changes to make while taking Mounjaro | What are the alternatives to Mounjaro? | To sum it up… | FAQs,"When to take Mounjaro | Mounjaro dosage | What if you miss a dose of Mounjaro | How to take Mounjaro | How to manage nausea | Lifestyle changes to make while taking Mounjaro | So, is there an alternative at all?",,111,We have sent a passcode to above number. Please enter your code.,19868,12,"data:image/gif;base64,R0lGODlhAQABAAD/ACwAAAAAAQABAAACADs= | https://cdn.aktive.co.in/images/in/page/mounjaro-kwikpen-injection-banner-v1.jpg | https://cdn.aktive.co.in/images/in/page/eat-smaller-meals.svg | https://cdn.aktive.co.in/images/in/page/stop-eating.svg | https://cdn.aktive.co.in/images/in/page/avoid-frieds.svg | https://cdn.aktive.co.in/images/in/page/bland-foods-new.svg | https://cdn.aktive.co.in/images/in/page/eat-well-icons.svg | https://cdn.aktive.co.in/images/in/page/stay-hydrated-icons.svg | https://cdn.aktive.co.in/images/in/page/think-well-icons.svg | https://cdn.aktive.co.in/images/in/page/sleep-well-icons.svg | https://cdn.aktive.co.in/images/in/theme/apple-mob-logo.png | https://cdn.aktive.co.in/images/in/theme/google-mob-logo.png",Aktive | Mounjaro Kwipen injection | Image 1 | Image 2 | Image 3 | Image 4 | Image 1 | Image 2 | Image 3 | Image 4 | Logo | Logo,64,6,24,2,
mounjaro-side-effects,mounjaro-side-effects.html,mounjaro-side-effects.html,How to Manage Mounjaro Side Effects,How to Manage Mounjaro Side Effects,Mounjaro comes with common side effects like nausea or fatigue. Discover how to manage them and when to seek help for a safer weight loss experience.,Mounjaro comes with common side effects like nausea or fatigue. Discover how to manage them and when to seek help for a safer weight loss experience.,,//cdn.aktive.co.in/images/in/theme/aktive-logo-200.png,,,,,Side effects of Mounjaro & how to manage them,"Key takeaways: | How does Mounjaro work? | What are the side effects of taking Mounjaro? | How to manage common side effects of Mounjaro? | What makes some people more sensitive to Mounjaro than others? | When should you visit the doctor? | Do the side effects go away over time? | Practical tips to feel better while your body adjusts | Everybody reacts differently, and that's okay. | FAQs",,,97,We have sent a passcode to above number. Please enter your code.,18349,20,"data:image/gif;base64,R0lGODlhAQABAAD/ACwAAAAAAQABAAACADs= | https://cdn.aktive.co.in/images/in/page/mounjaro-injection-pen.jpg | https://cdn.aktive.co.in/images/in/page/gut-hormones.png | https://cdn.aktive.co.in/images/in/page/stomach.png | https://cdn.aktive.co.in/images/in/page/brain-solo.png | https://cdn.aktive.co.in/images/in/page/nausea.svg | https://cdn.aktive.co.in/images/in/page/diarrhea.svg | https://cdn.aktive.co.in/images/in/page/vomiting.svg | https://cdn.aktive.co.in/images/in/page/constipation.svg | https://cdn.aktive.co.in/images/in/page/side-effects-of-taking-mounjaro-desk-new.svg | https://cdn.aktive.co.in/images/in/page/nausea.svg | https://cdn.aktive.co.in/images/in/page/vomiting.svg | https://cdn.aktive.co.in/images/in/page/diarrhea.svg | https://cdn.aktive.co.in/images/in/page/constipation.svg | https://cdn.aktive.co.in/images/in/page/decreased-appetite-icon.svg | https://cdn.aktive.co.in/images/in/page/fatigue.svg | https://cdn.aktive.co.in/images/in/page/headaches-icon.svg | https://cdn.aktive.co.in/images/in/page/injection-site-reactions-icon-new.svg | https://cdn.aktive.co.in/images/in/theme/apple-mob-logo.png | https://cdn.aktive.co.in/images/in/theme/google-mob-logo.png",Aktive | Mounjaro injection pen | Gut hormones | Slows digestion so you stay satisfied longer | Signals your brain that you’re full | Use healthier ingredients | Try better cooking methods | portions and mealtimes | Add some protein | Side effects of taking Mounjaro | Nausea | Vomiting | Diarrhoea | Constipation | Decreased appetite | Fatigue | Headaches | Injection site reactions | Logo | Logo,54,9,11,0,
mounjaro-weight-loss-timeline,mounjaro-weight-loss-timeline.html,mounjaro-weight-loss-timeline.html,How Long Does It Take to Lose Weight on Mounjaro?,How Long Does It Take to Lose Weight on Mounjaro?,"How long does Mounjaro take to work? Discover the weight loss drug’s efficacy, week-by-week timeline, factors affecting weight loss, and tips to maximise results.","How long does Mounjaro take to work? Discover the weight loss drug’s efficacy, week-by-week timeline, factors affecting weight loss, and tips to maximise results.",,//cdn.aktive.co.in/images/in/theme/aktive-logo-200.png,,,,,Mounjaro weight loss timeline: A complete guide,Key takeaways: | How much weight can you lose on Mounjaro? | A week-by-week weight loss timeline with Mounjaro | Factors that may affect Mounjaro results | How to know you’re actually losing weight? | Not losing weight on Mounjaro? Here’s what to do | To conclude | FAQs,"So, what can you do?",,110,We have sent a passcode to above number. Please enter your code.,13865,9,"data:image/gif;base64,R0lGODlhAQABAAD/ACwAAAAAAQABAAACADs= | https://cdn.aktive.co.in/images/in/page/mounjaro-weight-loss_time-banner.jpg | https://cdn.aktive.co.in/images/in/page/weighing-machine.svg | https://cdn.aktive.co.in/images/in/page/age-icon.svg | https://cdn.aktive.co.in/images/in/page/fork-spoon-icon.svg | https://cdn.aktive.co.in/images/in/page/calendar-check-icon.svg | https://cdn.aktive.co.in/images/in/page/medical-icon.svg | https://cdn.aktive.co.in/images/in/theme/apple-mob-logo.png | https://cdn.aktive.co.in/images/in/theme/google-mob-logo.png",Aktive | 2.5mg Mounjaro KwikPen with cap opened. | starting weight icon | age icon | diet icon | daily habits | medical history icon | Logo | Logo,51,6,17,0,
mounjaro-weight-loss-tips,mounjaro-weight-loss-tips.html,mounjaro-weight-loss-tips.html,8 Tips for Increasing Weight Loss with Mounjaro,8 Tips for Increasing Weight Loss with Mounjaro,"Started on Mounjaro for weight loss? Learn essential lifestyle changes - from diet tips to exercise, sleep, and stress management for better results.","Started on Mounjaro for weight loss? Learn essential lifestyle changes - from diet tips to exercise, sleep, and stress management for better results.",,//cdn.aktive.co.in/images/in/theme/aktive-logo-200.png,,,,,How to increase weight loss on Mounjaro?,"Key takeaways: | 1. Eat right, eat well | 2. Stay fit, stay active | 3. Hydrate well | 4. Get enough sleep | 5. Unwind and relax | 6. Set realistic goals & track them right | 7. Build a support system | 8. Stay in touch with your doctor | It starts with small changes | FAQs",How to eat healthy on Mounjaro: | Here are some of the best exercises for Mounjaro users: | How to stay well-hydrated on Mounjaro: | How to increase your sleep quality: | Here’s what you can do to prevent stress eating: | Here are some doable things you can try: | Here’s how you can lean on your loved ones: | Check-in with your doctor if:,,87,We have sent a passcode to above number. Please enter your code.,14861,12,"data:image/gif;base64,R0lGODlhAQABAAD/ACwAAAAAAQABAAACADs= | https://cdn.aktive.co.in/images/in/page/eight-ways-to-lose-more-weight.jpg | https://cdn.aktive.co.in/images/in/page/fork-spoon-icon.svg | https://cdn.aktive.co.in/images/in/page/exercise-icon.svg | https://cdn.aktive.co.in/images/in/page/water-drop-icon.svg | https://cdn.aktive.co.in/images/in/page/moon-stars-icon.svg | https://cdn.aktive.co.in/images/in/page/face-calm-icon.svg | https://cdn.aktive.co.in/images/in/page/signal-icon.svg | https://cdn.aktive.co.in/images/in/page/people-icon.svg | https://cdn.aktive.co.in/images/in/page/stethoscope-icon.svg | https://cdn.aktive.co.in/images/in/theme/apple-mob-logo.png | https://cdn.aktive.co.in/images/in/theme/google-mob-logo.png",Aktive | How to increase weight loss on Mounjaro | Image 1 | Image 2 | Image 3 | Image 4 | Image 4 | Image 4 | Image 4 | Image 4 | Logo | Logo,58,7,21,1,
my-profile,my-profile.html,logout.html,ᐅ Aktive • The New Way to Lose Weight,ᐅ Aktive • The New Way to Lose Weight,"Start your weight loss journey with Aktive’s proven, science-based plans, tailored to meet your individual goals and deliver real results. Join us now!","Start your weight loss journey with Aktive’s proven, science-based plans, tailored to meet your individual goals and deliver real results. Join us now!",,//cdn.aktive.co.in/images/in/theme/aktive-logo-200.png,,,,,"Let science help you lose weight, and keep it off","What if you could trick your brain, thinking you’re full? | The good news: Our treatment gives your brain the ‘full’ signal | Clinical trials show that with our approach, you lose 5 times more weight than with diet & exercise alone. | A proven result of 21% weight loss in 16 months. Curious as to how much you could lose? | The breakthrough in weight loss medication has hit the news big time. | Simple, smart, and scientific. Our weight loss programme works where others fail. | Ready to start losing weight and feeling fit? Take your first step now: | Your health guide",Disclaimer and sources,,26,We have sent a passcode to above number. Please enter your code.,428,38,"data:image/gif;base64,R0lGODlhAQABAAD/ACwAAAAAAQABAAACADs= | https://cdn.aktive.co.in/images/brand/theme/banner-image.jpg?v=1.1 | https://cdn.aktive.co.in/images/brand/theme/banner-1.webp?v=1.1 | https://cdn.aktive.co.in/images/brand/theme/banner-graph.svg?v=2.1 | data:image/gif;base64,R0lGODlhAQABAAD/ACwAAAAAAQABAAACADs= | data:image/gif;base64,R0lGODlhAQABAAD/ACwAAAAAAQABAAACADs= | https://cdn.aktive.co.in/images/brand/theme/graph-line-v3.png?v=1.1 | data:image/gif;base64,R0lGODlhAQABAAD/ACwAAAAAAQABAAACADs= | data:image/gif;base64,R0lGODlhAQABAAD/ACwAAAAAAQABAAACADs= | data:image/gif;base64,R0lGODlhAQABAAD/ACwAAAAAAQABAAACADs= | data:image/gif;base64,R0lGODlhAQABAAD/ACwAAAAAAQABAAACADs= | data:image/gif;base64,R0lGODlhAQABAAD/ACwAAAAAAQABAAACADs= | data:image/gif;base64,R0lGODlhAQABAAD/ACwAAAAAAQABAAACADs= | data:image/gif;base64,R0lGODlhAQABAAD/ACwAAAAAAQABAAACADs= | data:image/gif;base64,R0lGODlhAQABAAD/ACwAAAAAAQABAAACADs= | data:image/gif;base64,R0lGODlhAQABAAD/ACwAAAAAAQABAAACADs= | data:image/gif;base64,R0lGODlhAQABAAD/ACwAAAAAAQABAAACADs= | data:image/gif;base64,R0lGODlhAQABAAD/ACwAAAAAAQABAAACADs= | data:image/gif;base64,R0lGODlhAQABAAD/ACwAAAAAAQABAAACADs= | data:image/gif;base64,R0lGODlhAQABAAD/ACwAAAAAAQABAAACADs= | data:image/gif;base64,R0lGODlhAQABAAD/ACwAAAAAAQABAAACADs= | data:image/gif;base64,R0lGODlhAQABAAD/ACwAAAAAAQABAAACADs= | data:image/gif;base64,R0lGODlhAQABAAD/ACwAAAAAAQABAAACADs= | data:image/gif;base64,R0lGODlhAQABAAD/ACwAAAAAAQABAAACADs= | data:image/gif;base64,R0lGODlhAQABAAD/ACwAAAAAAQABAAACADs= | data:image/gif;base64,R0lGODlhAQABAAD/ACwAAAAAAQABAAACADs= | data:image/gif;base64,R0lGODlhAQABAAD/ACwAAAAAAQABAAACADs= | data:image/gif;base64,R0lGODlhAQABAAD/ACwAAAAAAQABAAACADs= | data:image/gif;base64,R0lGODlhAQABAAD/ACwAAAAAAQABAAACADs= | data:image/gif;base64,R0lGODlhAQABAAD/ACwAAAAAAQABAAACADs= | data:image/gif;base64,R0lGODlhAQABAAD/ACwAAAAAAQABAAACADs= | data:image/gif;base64,R0lGODlhAQABAAD/ACwAAAAAAQABAAACADs= | data:image/gif;base64,R0lGODlhAQABAAD/ACwAAAAAAQABAAACADs= | data:image/gif;base64,R0lGODlhAQABAAD/ACwAAAAAAQABAAACADs= | data:image/gif;base64,R0lGODlhAQABAAD/ACwAAAAAAQABAAACADs= | data:image/gif;base64,R0lGODlhAQABAAD/ACwAAAAAAQABAAACADs= | https://cdn.aktive.co.in/images/in/theme/apple-mob-logo.png | https://cdn.aktive.co.in/images/in/theme/google-mob-logo.png","Aktive | Banner image | Let science help you lose weight, and keep it off | Let science help you lose weight, and keep it off | Brain image | Brain image2 | graph line | Reuters | Business Standard | India Today | The Indian Express | Firstpost | I love food too much to go on a diet | Why is this different from other weight loss plans? | I've tried everything... nothing works | I don't have time to exercise | It’s too difficult to stay motivated | Select the plan that suits you | Answer a few medical questions | Receive your supply | Mounjaro weight loss timeline: A complete guide | 9 almost zero-calorie foods that’ll help you lose weight | How to increase weight loss on Mounjaro? | How to increase weight loss on Wegovy? | 8 healthy Indian breakfast recipes for weight loss | 7-day high-protein diet plan for weight loss (Indian recipes) | How much protein does 100g chana have? | Protein in 100g soya: Benefits, nutrition, & daily intake guide | Wegovy dosage guide for weight loss | How to inject Wegovy - A complete guide | Mounjaro dosage for weight loss | Wegovy side effects | mounjaro side effects | wegovy injection | How to take Mounjaro injection? | 11 benefits of drinking hot water you didn’t know about | Logo | Logo",61,5,0,0,
