slug,filename,canonical_url,title,og_title,meta_description,og_description,meta_keywords,og_image,published_date,modified_date,author,category,h1,h2,h3,h4,paragraph_count,first_paragraph,main_text_length,image_count,images,image_alts,internal_links_count,external_links_count,faq_count,table_count,breadcrumbs
health-guide,health-guide.html,health-guide.html,"ᐅ Health Guide • Weight Loss Tips, Foods & Trends",,Learn how to manage weight loss with expert-backed tips on diet and lifestyle. Build healthier habits for lasting change with our health guide.,,,,,,,,Health guide,"Mounjaro weight loss timeline: A complete guide | 9 almost zero-calorie foods that’ll help you lose weight | How to increase weight loss on Mounjaro? | How to increase weight loss on Wegovy? | 8 healthy Indian breakfast recipes for weight loss | 7-day high-protein diet plan for weight loss (Indian recipes) | How much protein does 100g chana have? | Protein in 100g soya: Benefits, nutrition, & daily intake guide | Wegovy dosage guide for weight loss | How to inject Wegovy - A complete guide | Mounjaro dosage chart for weight loss | How to manage Wegovy side effects? | Side effects of Mounjaro & how to manage them | Wegovy launched in India: What you need to know about it | How to take Mounjaro injection? | 11 benefits of drinking hot water you didn’t know about | Can you drink black coffee for weight loss? Let’s find out | Calories in an apple: Everything you need to know | How many calories does a mango have? Find out here | 5 food cravings: What they mean & how to stop them | How many calories does a dosa have? | Discover 11 types of millets in India and their health benefits | Weight loss drug Mounjaro launched in India | 5 simple yoga poses for weight loss at home | Explained: Calories & protein in 100g paneer | Explained: Benefits of surya namaskar & how to perform | Confused about the calories in 1 roti? We can help! | How to lose weight with PCOS? Try these 10 simple tips | 10 exercises to reduce belly fat: No gym subscription needed | Why these 9 dry fruits are must-have for your health | Can a dish of poha a day keep the doctor away? | Makhanas benefits for weight loss: 10 easy recipes to try today | 9 easy ways to eat chia seeds for weight loss | 7 best Indian homemade drinks to try for weight loss | What to know before taking Wegovy for weight loss? | How Rybelsus tablet helped Indians lose weight | How jeera water benefits weight loss | All about Ozempic injection for weight loss | CICO diet for weight loss: All you need to know | Can 10,000 steps a day keep the doctor away?",,,96,We have sent a passcode to above number. Please enter your code.,12804,43,"data:image/gif;base64,R0lGODlhAQABAAD/ACwAAAAAAQABAAACADs= | https://cdn.aktive.co.in/images/in/page/mounjaro-weight-loss_time-banner.jpg | https://cdn.aktive.co.in/images/in/page/low-cal-foods-weight-loss.jpg | https://cdn.aktive.co.in/images/in/page/eight-ways-to-lose-more-weight.jpg | https://cdn.aktive.co.in/images/in/page/five-ways-lose-more-weight.jpg | https://cdn.aktive.co.in/images/in/page/breakfast-lowcalorie.jpg | https://cdn.aktive.co.in/images/in/page/prodien-seven-banner.jpg | https://cdn.aktive.co.in/images/in/page/chana-banner-image.jpg | https://cdn.aktive.co.in/images/in/page/soybeans-in-bowl.jpg | https://cdn.aktive.co.in/images/in/page/wegovy-dosage-schedule-new.jpg | https://cdn.aktive.co.in/images/in/page/how-to-inject-wegovy-banner.jpg | https://cdn.aktive.co.in/images/in/page/Hero-image.jpg | https://cdn.aktive.co.in/images/in/page/wegovy-flextouch-pen-new.jpg | https://cdn.aktive.co.in/images/in/page/mounjaro-injection-pen.jpg | https://cdn.aktive.co.in/images/in/page/wegovy-weight-loss-injection-banner-img.jpg | https://cdn.aktive.co.in/images/in/page/mounjaro-updt-banner-new-v1.jpg | https://cdn.aktive.co.in/images/in/page/glass-of-hot-water-new-v1.jpg | https://cdn.aktive.co.in/images/in/page/blackcoffee-calaroies-v1.jpg | https://cdn.aktive.co.in/images/in/page/apple-banner-image-v1.jpg | https://cdn.aktive.co.in/images/in/page/mango-caloriess-v1.jpg | https://cdn.aktive.co.in/images/in/page/food-cravings-v1.jpg | https://cdn.aktive.co.in/images/in/page/dosas-banner-v1.jpg | https://cdn.aktive.co.in/images/in/page/final-millets-bannr-v1.jpg | https://cdn.aktive.co.in/images/in/page/mounjaro-kwikpen-injection-banner-v1.jpg | https://cdn.aktive.co.in/images/in/page/five-yoga-pose-v1.jpg | https://cdn.aktive.co.in/images/in/page/panner-banner-v1.jpg | https://cdn.aktive.co.in/images/in/page/surya-namaskar-final-v2.png | https://cdn.aktive.co.in/images/in/page/roti-banner-image.jpg | https://cdn.aktive.co.in/images/in/page/pcos-banner.jpg | https://cdn.aktive.co.in/images/in/page/banner-exercise-image.png | https://cdn.aktive.co.in/images/in/page/dry-fruits-banner-updated.jpg | https://cdn.aktive.co.in/images/in/page/poha-banner-updated.png | https://cdn.aktive.co.in/images/in/page/makhna_image_banner.jpg | https://cdn.aktive.co.in/images/in/page/how-to-eat-chia-seeds-for-weight-loss-v1.jpg | https://cdn.aktive.co.in/images/in/page/indian-drinks-try-for-weight-loss.jpg | https://cdn.aktive.co.in/images/in/page/new-banner-images.jpg | https://cdn.aktive.co.in/images/in/page/novo_nordisk_pharma_rybelsus-3-mg-semaglutide-310-s-tablets.jpg | https://cdn.aktive.co.in/images/in/page/health_tech_A_realistic_side-view_photo_of_a_white_cup_filled.jpg | https://cdn.aktive.co.in/images/in/page/ozempic-insulin-injection-pen-cartridge-diabetics-new1.webp | https://cdn.aktive.co.in/images/in/page/calories-counting-diet-food.webp | https://cdn.aktive.co.in/images/in/page/10000-steps-male.webp | https://cdn.aktive.co.in/images/in/theme/apple-mob-logo.png | https://cdn.aktive.co.in/images/in/theme/google-mob-logo.png","Aktive | 2.5mg Mounjaro KwikPen with cap opened. | 9 low-calorie foods for weight loss | How to increase weight loss on Mounjaro | Five ways to lose weight | Assorted Indian breakfast dishes | Two rice bowls with fried diced tofu, edamame, sweetcorn and kidney beans placed on a table | Dry organic kala chana (desi chickpeas) in a rustic bowl. | soybeans in a wooden bowl | article-image | A woman injecting an injection pen | A dosage chart showing different Mounjaro doses | wegovy-flextouch-pen | Mounjaro injection pen | Wegovy packaging boxes 0.25 mg and 2.4 mg with pre filled injection pens | Mounjaro Kwipen injection. | A glass of hot water | A cup of black coffee with coffee beans surrounding it | A basket of apples | calories-in-a-mango | Indian woman craving a cupcake | Crispy dosa on a plate | Types of Millets in India | Mounjaro Kwipen injection | Indian woman performing a yoga pose for weight loss | Cubes of Paneer In A Bowl | Benefits of surya namaskar and 12 surya namaskar steps | roti image | article-image | article-image | article-image | A dish of poha | Makhanas benefits | how to eat chia seeds for weight loss | 7 best drinks for weight loss | Wegovy injection for weight loss | Rybelsus 3 mg tablets in India | A glass of jeera water | Ozempic injection pen | Woman using calorie counter application on her smartphone at dining table with salad, fruit juice, b | Man using a daily activity tracking app on a mobile phone showing 10,000 steps daily goal achievemen | Logo | Logo",80,7,0,0,
high-protein-indian-diet-plan,high-protein-indian-diet-plan.html,high-protein-indian-diet-plan.html,7-Day High-Protein Indian Diet Plan for Weight Loss,7-Day High-Protein Indian Diet Plan for Weight Loss,"Transform your health with this 7-day high-protein diet plan designed for Indians. Simple recipes, everyday ingredients - perfect for weight loss at home!","Transform your health with this 7-day high-protein diet plan designed for Indians. Simple recipes, everyday ingredients - perfect for weight loss at home!",,//cdn.aktive.co.in/images/in/theme/aktive-logo-200.png,,,,,7-day high-protein diet plan for weight loss (Indian recipes),Key takeaways | What is a high-protein diet? | How much protein do you need to eat daily? | How does a high-protein diet help in weight loss? | Protein-rich foods in the Indian diet | Your 7-day protein diet plan for weight loss | Conclusion | FAQs,Vegetarian protein-rich foods | Non-Vegetarian protein-rich foods | Moong dal cheela | Creamy dal makhani with steamed rice | Masala sprouts salad | Spinach (palak) dal soup with garlic croutons | Paneer veggie wrap | Palak paneer bowl with quinoa | Tandoori paneer skewers | Shahi paneer with multigrain roti | Scrambled egg toast | Egg quinoa | Deviled eggs | Egg salad bowl | Soya chunks stir-fry | Green masala soya kheema | Air-fried soya chunks | Soya pulao | Vegetable upma | Chickpea (chana) pulao | Greek yogurt with cucumber and mint | Stuffed capsicum with lentils | Grilled chicken wrap | Butter chicken with jeera rice | Tandoori chicken bites | Lemon herb grilled chicken salad | Ragi pancakes | Vegetable millet khichdi | Foxtail millet (kangni) ladoo | Bajra roti with lentil curry,,160,We have sent a passcode to above number. Please enter your code.,20089,32,"data:image/gif;base64,R0lGODlhAQABAAD/ACwAAAAAAQABAAACADs= | https://cdn.aktive.co.in/images/in/page/prodien-seven-banner.jpg | https://cdn.aktive.co.in/images/in/page/overnight-moong-dal-cheela.jpg | https://cdn.aktive.co.in/images/in/page/creamy-dal-makhani-with-steamed-rice.jpg | https://cdn.aktive.co.in/images/in/page/masala-sprouts-salad.jpg | https://cdn.aktive.co.in/images/in/page/spinach-palak-dal-soup-with-garlic-croutons.jpg | https://cdn.aktive.co.in/images/in/page/paneer-veggie-wrap.jpg | https://cdn.aktive.co.in/images/in/page/paneer-veggie-wrap-1.jpg | https://cdn.aktive.co.in/images/in/page/tandoori-paneer-skewers.jpg | https://cdn.aktive.co.in/images/in/page/shahi-paneer-with-multigrain-roti.jpg | https://cdn.aktive.co.in/images/in/page/scrambled-egg-toast.jpg | https://cdn.aktive.co.in/images/in/page/egg-quinoa.jpg | https://cdn.aktive.co.in/images/in/page/deviled-eggs.jpg | https://cdn.aktive.co.in/images/in/page/egg-salad-bowl.jpg | https://cdn.aktive.co.in/images/in/page/soya-chunk-stir-fry.jpg | https://cdn.aktive.co.in/images/in/page/green-masala-soya-kheema.jpg | https://cdn.aktive.co.in/images/in/page/airfried-soya-chunks.jpg | https://cdn.aktive.co.in/images/in/page/soya-pulaoos.jpg | https://cdn.aktive.co.in/images/in/page/vegetable-upma.jpg | https://cdn.aktive.co.in/images/in/page/chickpea-chana-pulao.jpg | https://cdn.aktive.co.in/images/in/page/greek-yogurt-with-cucumber-and-mint.jpg | https://cdn.aktive.co.in/images/in/page/stuffed-cap-with-lentils.jpg | https://cdn.aktive.co.in/images/in/page/grilled-chicken-wrap.jpg | https://cdn.aktive.co.in/images/in/page/butter-chicken-with-jeera-rice.jpg | https://cdn.aktive.co.in/images/in/page/tandoor-chicken-bites.jpg | https://cdn.aktive.co.in/images/in/page/lemon-herb-grilled-chicken-salad.jpg | https://cdn.aktive.co.in/images/in/page/ragi-pancakes.jpg | https://cdn.aktive.co.in/images/in/page/veg-millet-khichdi.jpg | https://cdn.aktive.co.in/images/in/page/foxtail-millet-kangni-ladoo.jpg | https://cdn.aktive.co.in/images/in/page/aajra-roti-with-lentil-curry.jpg | https://cdn.aktive.co.in/images/in/theme/apple-mob-logo.png | https://cdn.aktive.co.in/images/in/theme/google-mob-logo.png","Aktive | Two rice bowls with fried diced tofu, edamame, sweetcorn and kidney beans placed on a table | Moong dal chillas served on a plate with green chutney | Dal makhani and vegetable rice in a bowl on a table | Bowl of sprout salad with vegetables | Bowl of spinach soup garnished with croutons | Paneer wrap on a white plate | Palak paneer and quinoa in a bowl | Paneer cubes marinated and grilled and served on skewers | Paneer gravy with multigrain roti on a plate | Scrambled eggs on a toast in a plate | Egg quinoa in a bowl on a wooden table | Devilled eggs on a white plate | Egg salad bowl | Soya chunks with sauteed veggies in a bowl | Green masala soya kheema served with roti on a plate | Air-fried golden brown soya chunks in a bowl | soya chunk pulao in a bowl | Rava upma with veggies in a bowl | Dal makhani and vegetable rice in a bowl on a table | Greek yoghurt with cucumber and mint leaves in a bowl | Stuffed capsicum with lentils | Chicken wrap on a white plate | Butter chicken with jeera rice on a white plate | Tandoori chicken bites on a plate | Grilled chicken salad in a bowl | Ragi pancakes | Vegetable millet khichdi in a bowl | Foxtail laddoos in a bowl | Bajra roti with lentil soup on a white plate | Logo | Logo",51,7,24,2,
hot-water-benefits,hot-water-benefits.html,hot-water-benefits.html,11 Health Benefits of Drinking Hot Water,11 Health Benefits of Drinking Hot Water,"From soothing sore throats to helping with weight loss, the benefits of drinking hot water are undeniable. Find out how this time-tested ritual works.","From soothing sore throats to helping with weight loss, the benefits of drinking hot water are undeniable. Find out how this time-tested ritual works.",,//cdn.aktive.co.in/images/in/theme/aktive-logo-200.png,,,,,11 benefits of drinking hot water you didn’t know about | When is the best time to drink hot water?,Key takeaways | What are the benefits of drinking hot water? | Who must avoid drinking hot water? | When is the best time to drink hot water? | How can you make drinking hot water a habit? | FAQs,1. Improves digestion & controls appetite | 2. May help lose weight | 3. Eases menstrual cramps | 4. Boosts metabolism | 5. Clears congestion & soothes sore throat | 6. Improves blood circulation | 7. Relaxes muscles | 8. Supports the immune system | 9. Keeps the mouth fresh | 10. Makes skin and hair healthy | 11. Improves bladder control | Upon Waking Up | Before Meals | After Meals (Wait 1 hour) | Before Bedtime | Throughout the Day | During Cold Weather or Illness | During Panchakarma & Snehapana,,102,We have sent a passcode to above number. Please enter your code.,15116,6,"data:image/gif;base64,R0lGODlhAQABAAD/ACwAAAAAAQABAAACADs= | https://cdn.aktive.co.in/images/in/page/glass-of-hot-water-new-v1.jpg | https://cdn.aktive.co.in/images/in/page/benefit-of-hot-water.svg | https://cdn.aktive.co.in/images/in/page/when-should-you-not-drink-hot-water.svg | https://cdn.aktive.co.in/images/in/theme/apple-mob-logo.png | https://cdn.aktive.co.in/images/in/theme/google-mob-logo.png",Aktive | A glass of hot water | How does drinking hot water benefit my health | When should you not drink hot water | Logo | Logo,52,14,6,0,
how-to-control-food-cravings,how-to-control-food-cravings.html,how-to-control-food-cravings.html,5 Major Food Cravings & How to Deal With Them,5 Major Food Cravings & How to Deal With Them,"Craving sweets, chocolate or fried food? Find out what 5 common cravings say about your health—and get smart food swaps to beat them naturally.","Craving sweets, chocolate or fried food? Find out what 5 common cravings say about your health—and get smart food swaps to beat them naturally.",,//cdn.aktive.co.in/images/in/theme/aktive-logo-200.png,,,,,5 food cravings: What they mean & how to stop them,"Key Takeaways: | What are food cravings? | Why do we have cravings? | 5 different food cravings and what they mean | How to stop food cravings? | Can cravings be a sign of disease? | Cravings are signals, not failures | FAQs",1. Sweet and chocolaty treats | 2. Starchy indulgence | 3. Fried or fatty foods | 4. Twisted tanginess (salty and sour foods) | 5. Bubbly (or not) beverages and substances,,112,We have sent a passcode to above number. Please enter your code.,17709,10,"data:image/gif;base64,R0lGODlhAQABAAD/ACwAAAAAAQABAAACADs= | https://cdn.aktive.co.in/images/in/page/food-cravings-v1.jpg | https://cdn.aktive.co.in/images/in/page/what-causes-food-cravings.svg | https://cdn.aktive.co.in/images/in/page/sweet-and-chocolaty-treats.svg | https://cdn.aktive.co.in/images/in/page/starchy-indulgence.svg | https://cdn.aktive.co.in/images/in/page/fried-fatty-foods-new.svg | https://cdn.aktive.co.in/images/in/page/twisted-tanginess-salty-sour.svg | https://cdn.aktive.co.in/images/in/page/bubbly-beverages-and-substance.svg | https://cdn.aktive.co.in/images/in/theme/apple-mob-logo.png | https://cdn.aktive.co.in/images/in/theme/google-mob-logo.png",Aktive | Indian woman craving a cupcake | What causes food cravings | Sweet and chocolaty treats | Starchy indulgence | Fried or fatty foods | Twisted tanginess (salty and sour foods) | Bubbly (or not) beverages and substances | Logo | Logo,54,6,20,1,
how-to-lose-weight-with-pcos,how-to-lose-weight-with-pcos.html,how-to-lose-weight-with-pcos.html,How To Lose Weight With PCOS? Here Are 10 Easy Tips,How To Lose Weight With PCOS? Here Are 10 Easy Tips,Wondering how to lose weight with PCOS? Try these 10 simple PCOS weight loss tips to get fit and manage your symptoms effectively.,Wondering how to lose weight with PCOS? Try these 10 simple PCOS weight loss tips to get fit and manage your symptoms effectively.,,//cdn.aktive.co.in/images/in/theme/aktive-logo-200.png,,,,,How to lose weight with PCOS? Try these 10 simple tips,Key takeaways: | Introduction | What is PCOS? | How to lose weight with PCOS? | Conclusion | FAQs,But why is it hard to lose weight with PCOS? | Tip 1: Focus on low glycemic index (GI) foods | Tip 2: Eat more protein | Tip 3: Practice mindful eating | Tip 4: Increase strength training and resistance exercises | Tip 5: Time to de-stress! | Tip 6: Sleep well | Tip 7: Avoid sugary and processed foods | Tip 8: Stay hydrated | Tip 9: Try intermittent fasting (IF) | Tip 10: Track your progress,,161,We have sent a passcode to above number. Please enter your code.,27708,13,"data:image/gif;base64,R0lGODlhAQABAAD/ACwAAAAAAQABAAACADs= | https://cdn.aktive.co.in/images/in/page/pcos-banner.jpg | https://cdn.aktive.co.in/images/in/page/foods-low-glycemic-index-on-gray.jpg | https://cdn.aktive.co.in/images/in/page/keto-food-ketogenic-diet-healthy-nutritional.jpg | https://cdn.aktive.co.in/images/in/page/happy-young-indian-woman-having-pancake.jpg | https://cdn.aktive.co.in/images/in/page/lift-like-your-life-depends-on.jpg | https://cdn.aktive.co.in/images/in/page/peaceful-young-indian-lady-sitting-on.jpg | https://cdn.aktive.co.in/images/in/page/handheld-shot-relaxed-alone-young-girl.jpg | https://cdn.aktive.co.in/images/in/page/say-no-sweet-during-diet-woman.jpg | https://cdn.aktive.co.in/images/in/page/portrait-young-woman-drinking-water-bottle.jpg | https://cdn.aktive.co.in/images/in/page/intermittent-fasting-clock-health-asian-young.jpg | https://cdn.aktive.co.in/images/in/theme/apple-mob-logo.png | https://cdn.aktive.co.in/images/in/theme/google-mob-logo.png",Aktive | article-image | low glycemic index foods for women with PCOS | A plate filled with high-protein foods | Indian woman trying mindful eating | Indian woman doing a strength training exercise | Indian women relaxing with a cup of tea | Indian woman sleeping soundly on bed | A woman says no to a sweet treat | Indian woman drinking from a bottle of water | woman performing intermittent fasting | Logo | Logo,60,30,8,1,
how-to-take-mounjaro,how-to-take-mounjaro.html,how-to-take-mounjaro.html,How to Take Mounjaro Injection Pen In India?,How to Take Mounjaro Injection Pen In India?,"Learn how to inject Mounjaro safely using the injection pen, where not to inject it, and how to store & dispose of it. Perfect for first-time users.","Learn how to inject Mounjaro safely using the injection pen, where not to inject it, and how to store & dispose of it. Perfect for first-time users.",,//cdn.aktive.co.in/images/in/theme/aktive-logo-200.png,,,,,How to take Mounjaro injection?,Key takeaways: | What is Mounjaro? | What is the Mounjaro injection pen? | How to prepare for the injection? | How to take Mounjaro? | Where not to inject Mounjaro? | How to store Mounjaro? | How to safely dispose of Mounjaro? | Ensuring a safe experience | FAQs,Let’s go step by step: | Having trouble with your Mounjaro pen? Try this: | What to do after injecting yourself?,,141,We have sent a passcode to above number. Please enter your code.,16254,21,"data:image/gif;base64,R0lGODlhAQABAAD/ACwAAAAAAQABAAACADs= | https://cdn.aktive.co.in/images/in/page/mounjaro-updt-banner-new-v1.jpg | https://cdn.aktive.co.in/images/in/page/part-of-the-mounjaro-kwikpen.jpg | https://cdn.aktive.co.in/images/in/page/how-to-take-mounjaro-updt-1.png | https://cdn.aktive.co.in/images/in/page/how-to-take-mounjaro-updt-2.png | https://cdn.aktive.co.in/images/in/page/how-to-take-mounjaro-updt-3.png | https://cdn.aktive.co.in/images/in/page/how-to-take-mounjaro-updt-4.png | https://cdn.aktive.co.in/images/in/page/how-to-take-mounjaro-updt-5.png | https://cdn.aktive.co.in/images/in/page/how-to-take-mounjaro-updt-6.png | https://cdn.aktive.co.in/images/in/page/how-to-take-mounjaro-updt-7.png | https://cdn.aktive.co.in/images/in/page/how-to-take-mounjaro-updt-8.png | https://cdn.aktive.co.in/images/in/page/how-to-take-mounjaro-updt-9.png | https://cdn.aktive.co.in/images/in/page/how-to-take-mounjaro-updt-10.png | https://cdn.aktive.co.in/images/in/page/how-to-take-mounjaro-updt-11.png | https://cdn.aktive.co.in/images/in/page/how-to-take-mounjaro-updt-12.png | https://cdn.aktive.co.in/images/in/page/how-to-take-mounjaro-updt-13.png | https://cdn.aktive.co.in/images/in/page/how-to-take-mounjaro-updt-14.png | https://cdn.aktive.co.in/images/in/page/how-to-take-mounjaro-updt-15.png | https://cdn.aktive.co.in/images/in/page/how-to-take-mounjaro-updt-16.png | https://cdn.aktive.co.in/images/in/theme/apple-mob-logo.png | https://cdn.aktive.co.in/images/in/theme/google-mob-logo.png",Aktive | Mounjaro Kwipen injection. | Parts of a Mounjaro injection pen (KwikPen). | Removing the pen cap. | Using a swab to wipe the red inner seal of the pen. | Removing paper tab from outer needle shield. | Attaching the capped needle to the pen. | Removing the outer and inner needle shield from the pen. | Turning the dose knob to set the dose. | Holding the pen upright and tapping to remove air bubbles. | Medicine droplet visible at needle tip. ‘5 sec. HOLD’ shown. | Ideal injection sites for Mounjaro. | Hand turning the dose knob of the Mounjaro pen to dial the dose. | Needle inserted into the skin and held till 5 counts. | Removing the needle from the skin. | Pressing the area with a cotton swab to stop bleeding after injection. | Covering the needle with the outer needle shield. | Removing the capped needle for disposal. | Covering the injection pen with the cap. | Logo | Logo,50,5,21,0,
how-to-take-wegovy,how-to-take-wegovy.html,how-to-take-wegovy.html,How to Take Wegovy Injection Pen?,How to Take Wegovy Injection Pen?,"Learn how to use the Wegovy injection pen safely with this easy step-by-step guide on preparing, injecting, and storing it.","Learn how to use the Wegovy injection pen safely with this easy step-by-step guide on preparing, injecting, and storing it.",,//cdn.aktive.co.in/images/in/theme/aktive-logo-200.png,,,,,How to inject Wegovy - A complete guide,Key takeaways: | What is Wegovy? | What’s inside a Wegovy pack? | What you should do before injecting Wegovy | How to take Wegovy - A step-by-step guide | How to store Wegovy? | Take one step at a time | FAQs,Before you prepare the injection | Know your Wegovy injection pen and needle | 1. Prepare your pen with a new needle | 2. Check the flow and set your dose | 3. Choose an injection site and inject your dose | 4. Inject Wegovy | 5. After your injection | 6. Disposing of the needle | 7. Know your needles,,98,We have sent a passcode to above number. Please enter your code.,14590,11,"data:image/gif;base64,R0lGODlhAQABAAD/ACwAAAAAAQABAAACADs= | https://cdn.aktive.co.in/images/in/page/how-to-inject-wegovy-banner.jpg | https://cdn.aktive.co.in/images/in/page/wegovy-flex-touch-pen-deskt.svg | https://cdn.aktive.co.in/images/in/page/flow-check-icon1.svg | https://cdn.aktive.co.in/images/in/page/number-zero1.svg | https://cdn.aktive.co.in/images/in/page/verticlal-line-icon1.svg | https://cdn.aktive.co.in/images/in/page/number-zero1.svg | https://cdn.aktive.co.in/images/in/page/number-zero1.svg | https://cdn.aktive.co.in/images/in/page/number-zero1.svg | https://cdn.aktive.co.in/images/in/theme/apple-mob-logo.png | https://cdn.aktive.co.in/images/in/theme/google-mob-logo.png",Aktive | A woman injecting an injection pen | Wegovy FlexTouch pen | Logo | Logo,48,4,9,0,
how-we-work,how-we-work.html,how-we-work.html,ᐅ How Our Weight Loss Service Works • Aktive,ᐅ How Our Weight Loss Service Works • Aktive,"See how our personalised weight loss programme helps you lose weight. From consultation to delivery, everything is simple, personalised, and fully online.","See how our personalised weight loss programme helps you lose weight. From consultation to delivery, everything is simple, personalised, and fully online.",,//cdn.aktive.co.in/images/in/theme/aktive-logo-200.png,,,,,How We Work,How our service works | How to start your weight loss journey | Achieving your goals is as easy as 1-2-3,What do you need to do? | How to start?,,11,We have sent a passcode to above number. Please enter your code.,0,8,"data:image/gif;base64,R0lGODlhAQABAAD/ACwAAAAAAQABAAACADs= | https://cdn.aktive.co.in/images/in/theme/how-our-service-works.png | https://cdn.aktive.co.in/images/in/theme/how-our-service-works.png | data:image/gif;base64,R0lGODlhAQABAAD/ACwAAAAAAQABAAACADs= | data:image/gif;base64,R0lGODlhAQABAAD/ACwAAAAAAQABAAACADs= | data:image/gif;base64,R0lGODlhAQABAAD/ACwAAAAAAQABAAACADs= | https://cdn.aktive.co.in/images/in/theme/apple-mob-logo.png | https://cdn.aktive.co.in/images/in/theme/google-mob-logo.png",Aktive | How our service works | How our service works | Select the plan that suits you | Answer a few medical questions | Receive your supply | Logo | Logo,41,3,0,0,
